{
  "schemaVersion": "1.0.0",
  "channelId": "folk-saying",
  "version": "0.1.0",
  "status": "COLLECTING",
  "assetPrefix": "folk-saying",
  "expectedCount": 12,
  "assets": [
    { "slot": 1, "form": "CIRCULAR", "treatment": "ORIGINAL", "expectedFilename": "folk-saying-circular-original.png", "status": "PENDING" },
    { "slot": 2, "form": "CIRCULAR", "treatment": "WHITE", "expectedFilename": "folk-saying-circular-white.png", "status": "PENDING" },
    { "slot": 3, "form": "CIRCULAR", "treatment": "BLACK", "expectedFilename": "folk-saying-circular-black.png", "status": "PENDING" },
    { "slot": 4, "form": "HORIZONTAL", "treatment": "ORIGINAL", "expectedFilename": "folk-saying-horizontal-original.png", "status": "PENDING" },
    {
      "slot": 5, "form": "HORIZONTAL", "treatment": "WHITE",
      "expectedFilename": "folk-saying-horizontal-white.png",
      "receivedFilename": "logos/folk-saying-horizontal-white.png",
      "status": "PASS",
      "validation": {
        "sha256": "11a66f328cd7bd0b37aeb1523e8289c34a301bc0a2d3b0c1c61eaa0217168bd0",
        "width": 1318, "height": 1030, "hasAlpha": true, "isOpaque": false,
        "embeddedCheckerboard": false, "artworkMatchesSlot": true, "result": "PASS",
        "reason": "Pixel-art speech-bubble 'Folks Saying' wordmark lockup. Already had real RGBA transparency; re-cropped to its own tight content bounds."
      }
    },
    {
      "slot": 6, "form": "HORIZONTAL", "treatment": "BLACK",
      "expectedFilename": "folk-saying-horizontal-black.png",
      "receivedFilename": "logos/folk-saying-horizontal-black.png",
      "status": "PASS",
      "validation": {
        "sha256": "4dc966fd2d431d12f09349e2b20e3e2e79352583dc78c6a377c0a2f9578de23c",
        "width": 1318, "height": 1030, "hasAlpha": true, "isOpaque": false,
        "embeddedCheckerboard": false, "artworkMatchesSlot": true, "result": "PASS",
        "reason": "Already had real RGBA transparency; re-cropped to its own tight content bounds."
      }
    },
    { "slot": 7, "form": "ICON_ONLY", "treatment": "ORIGINAL", "expectedFilename": "folk-saying-icon-only-original.png", "status": "PENDING" },
    {
      "slot": 8, "form": "ICON_ONLY", "treatment": "WHITE",
      "expectedFilename": "folk-saying-icon-only-white.png",
      "receivedFilename": "logos/folk-saying-icon-only-white.png",
      "status": "PASS",
      "validation": {
        "sha256": "207a0d778a24a9779c7ea1ccddd1e58325c02139a3d6a3f8ac638570b1ac605d",
        "width": 988, "height": 908, "hasAlpha": true, "isOpaque": false,
        "embeddedCheckerboard": false, "artworkMatchesSlot": true, "result": "PASS",
        "reason": "Isolated speech-bubble silhouette (no text). Already had real RGBA transparency; re-cropped to its own tight content bounds."
      }
    },
    {
      "slot": 9, "form": "ICON_ONLY", "treatment": "BLACK",
      "expectedFilename": "folk-saying-icon-only-black.png",
      "receivedFilename": "logos/folk-saying-icon-only-black.png",
      "status": "PASS",
      "validation": {
        "sha256": "01a130f74156083b7189f6c502058c543dae695a9a56a0303c86ca525f66dc56",
        "width": 988, "height": 908, "hasAlpha": true, "isOpaque": false,
        "embeddedCheckerboard": false, "artworkMatchesSlot": true, "result": "PASS",
        "reason": "Already had real RGBA transparency; re-cropped to its own tight content bounds."
      }
    },
    { "slot": 10, "form": "VERTICAL", "treatment": "ORIGINAL", "expectedFilename": "folk-saying-vertical-original.png", "status": "PENDING" },
    { "slot": 11, "form": "VERTICAL", "treatment": "WHITE", "expectedFilename": "folk-saying-vertical-white.png", "status": "PENDING" },
    { "slot": 12, "form": "VERTICAL", "treatment": "BLACK", "expectedFilename": "folk-saying-vertical-black.png", "status": "PENDING" }
  ]
}
