{
  "schemaVersion": "1.0.0",
  "channelId": "macaristan-rehberi",
  "version": "0.1.0",
  "status": "PASS",
  "assetPrefix": "macaristan-rehberi",
  "expectedCount": 12,
  "assets": [
    {
      "slot": 1, "form": "CIRCULAR", "treatment": "ORIGINAL",
      "expectedFilename": "macaristan-rehberi-circular-original.png",
      "receivedFilename": "logos/macaristan-rehberi-circular-original.png",
      "status": "PASS",
      "validation": {
        "sha256": "35f537f7d16ced40822e704df1fb83b512559d81854e76f4ae8079c31602b773",
        "width": 1254, "height": 1254, "hasAlpha": true, "isOpaque": false,
        "embeddedCheckerboard": false, "artworkMatchesSlot": true, "result": "PASS",
        "reason": "Circular badge: black ring, 'BB' monogram, 'BARLOVICS' (green) / 'TURKIYE' (red) arc text on white disc. Already had real RGBA transparency and a tight crop."
      }
    },
    {
      "slot": 2, "form": "CIRCULAR", "treatment": "WHITE",
      "expectedFilename": "macaristan-rehberi-circular-white.png",
      "receivedFilename": "logos/macaristan-rehberi-circular-white.png",
      "status": "PASS",
      "validation": {
        "sha256": "186999dd89c82f1f306fb8ba939a55914dcef91bc993e1506d7ffda947575e57",
        "width": 1254, "height": 1254, "hasAlpha": true, "isOpaque": false,
        "embeddedCheckerboard": false, "artworkMatchesSlot": true, "result": "PASS",
        "reason": "Already had real RGBA transparency and a tight crop."
      }
    },
    {
      "slot": 3, "form": "CIRCULAR", "treatment": "BLACK",
      "expectedFilename": "macaristan-rehberi-circular-black.png",
      "receivedFilename": "logos/macaristan-rehberi-circular-black.png",
      "status": "PASS",
      "validation": {
        "sha256": "1d350e61b6583a6b946bc18fbc6d2e438b2e85995bc4300262b9b613d4d9723a",
        "width": 1254, "height": 1254, "hasAlpha": true, "isOpaque": false,
        "embeddedCheckerboard": false, "artworkMatchesSlot": true, "result": "PASS",
        "reason": "Already had real RGBA transparency and a tight crop."
      }
    },
    { "slot": 4, "form": "HORIZONTAL", "treatment": "ORIGINAL", "expectedFilename": "macaristan-rehberi-horizontal-original.png", "status": "PENDING" },
    { "slot": 5, "form": "HORIZONTAL", "treatment": "WHITE", "expectedFilename": "macaristan-rehberi-horizontal-white.png", "status": "PENDING" },
    { "slot": 6, "form": "HORIZONTAL", "treatment": "BLACK", "expectedFilename": "macaristan-rehberi-horizontal-black.png", "status": "PENDING" },
    { "slot": 7, "form": "ICON_ONLY", "treatment": "ORIGINAL", "expectedFilename": "macaristan-rehberi-icon-only-original.png", "status": "PENDING" },
    { "slot": 8, "form": "ICON_ONLY", "treatment": "WHITE", "expectedFilename": "macaristan-rehberi-icon-only-white.png", "status": "PENDING" },
    { "slot": 9, "form": "ICON_ONLY", "treatment": "BLACK", "expectedFilename": "macaristan-rehberi-icon-only-black.png", "status": "PENDING" },
    { "slot": 10, "form": "VERTICAL", "treatment": "ORIGINAL", "expectedFilename": "macaristan-rehberi-vertical-original.png", "status": "PENDING" },
    { "slot": 11, "form": "VERTICAL", "treatment": "WHITE", "expectedFilename": "macaristan-rehberi-vertical-white.png", "status": "PENDING" },
    { "slot": 12, "form": "VERTICAL", "treatment": "BLACK", "expectedFilename": "macaristan-rehberi-vertical-black.png", "status": "PENDING" }
  ]
}
