{
  "schemaVersion": "1.0.0",
  "channelId": "tip-ogrencileri-platformu",
  "version": "0.1.0",
  "status": "PASS",
  "assetPrefix": "tip-ogrencileri-platformu",
  "expectedCount": 12,
  "assets": [
    {
      "slot": 1,
      "form": "CIRCULAR",
      "treatment": "ORIGINAL",
      "expectedFilename": "tip-ogrencileri-platformu-circular-original.png",
      "receivedFilename": "logos/tip-ogrencileri-platformu-circular-original.png",
      "status": "PASS",
      "validation": {
        "sha256": "7ebb72a632410c23809b318308f315ee5fd90c7b9ed85db41a48e7a2296e55c4",
        "width": 1254,
        "height": 1254,
        "hasAlpha": true,
        "isOpaque": false,
        "embeddedCheckerboard": false,
        "artworkMatchesSlot": true,
        "result": "PASS",
        "reason": "Programmatically re-extracted from the original source PNG: checkerboard/near-white background removed via connected-component background classification (protecting the enclosed cream disc fill from being flattened as background), true RGBA alpha applied, tightly cropped to content."
      }
    },
    {
      "slot": 2,
      "form": "CIRCULAR",
      "treatment": "WHITE",
      "expectedFilename": "tip-ogrencileri-platformu-circular-white.png",
      "receivedFilename": "logos/tip-ogrencileri-platformu-circular-white.png",
      "status": "PASS",
      "validation": {
        "sha256": "9ce36d9b90f3c5364e5be53172013aa6227826871aeb4caa246e3928e56ecb79",
        "width": 1254,
        "height": 1254,
        "hasAlpha": true,
        "isOpaque": false,
        "embeddedCheckerboard": false,
        "artworkMatchesSlot": true,
        "result": "PASS",
        "reason": "Silhouette mask derived from the geometrically-aligned slot 3 (circular black) source, since slot 2's own white-on-checkerboard source had no reliable direct color separation. Rendered solid white on true alpha transparency, tightly cropped to content."
      }
    },
    {
      "slot": 3,
      "form": "CIRCULAR",
      "treatment": "BLACK",
      "expectedFilename": "tip-ogrencileri-platformu-circular-black.png",
      "receivedFilename": "logos/tip-ogrencileri-platformu-circular-black.png",
      "status": "PASS",
      "validation": {
        "sha256": "ffaa892591edfce79a797b0e8d7e1a758383cfeb952c9a13db379b0acbd656d9",
        "width": 1254,
        "height": 1254,
        "hasAlpha": true,
        "isOpaque": false,
        "embeddedCheckerboard": false,
        "artworkMatchesSlot": true,
        "result": "PASS",
        "reason": "Programmatically re-extracted: checkerboard background removed via brightness/saturation threshold, true RGBA alpha applied, tightly cropped to content."
      }
    },
    {
      "slot": 4,
      "form": "HORIZONTAL",
      "treatment": "ORIGINAL",
      "expectedFilename": "tip-ogrencileri-platformu-horizontal-original.png",
      "receivedFilename": "logos/tip-ogrencileri-platformu-horizontal-original.png",
      "status": "PASS",
      "validation": {
        "sha256": "6c3b2d881d201a4ba90c42b6d0f7e72376a36ef264b2ade4c8d3a11a194bae60",
        "width": 1326,
        "height": 835,
        "hasAlpha": true,
        "isOpaque": false,
        "embeddedCheckerboard": false,
        "artworkMatchesSlot": true,
        "result": "PASS",
        "reason": "Programmatically re-extracted: checkerboard background removed via brightness/saturation threshold, true RGBA alpha applied, tightly cropped to content."
      }
    },
    {
      "slot": 5,
      "form": "HORIZONTAL",
      "treatment": "WHITE",
      "expectedFilename": "tip-ogrencileri-platformu-horizontal-white.png",
      "receivedFilename": "logos/tip-ogrencileri-platformu-horizontal-white.png",
      "status": "PASS",
      "validation": {
        "sha256": "4c47dc6bd7d95adfdaf9c65cf077c456e107ac7b5247ef456fbb73caaf25d6cb",
        "width": 1577,
        "height": 872,
        "hasAlpha": true,
        "isOpaque": false,
        "embeddedCheckerboard": false,
        "artworkMatchesSlot": true,
        "result": "PASS",
        "reason": "Silhouette mask derived from the geometrically-aligned slot 6 (horizontal black) source. Rendered solid white on true alpha transparency, tightly cropped to content."
      }
    },
    {
      "slot": 6,
      "form": "HORIZONTAL",
      "treatment": "BLACK",
      "expectedFilename": "tip-ogrencileri-platformu-horizontal-black.png",
      "receivedFilename": "logos/tip-ogrencileri-platformu-horizontal-black.png",
      "status": "PASS",
      "validation": {
        "sha256": "616d797649ed4840dfe63a5898de9bd38b153be9a2bb33dcd74bf9c824b77a0b",
        "width": 1577,
        "height": 872,
        "hasAlpha": true,
        "isOpaque": false,
        "embeddedCheckerboard": false,
        "artworkMatchesSlot": true,
        "result": "PASS",
        "reason": "Programmatically re-extracted: checkerboard background removed via brightness/saturation threshold, true RGBA alpha applied, tightly cropped to content."
      }
    },
    {
      "slot": 7,
      "form": "ICON_ONLY",
      "treatment": "ORIGINAL",
      "expectedFilename": "tip-ogrencileri-platformu-icon-only-original.png",
      "receivedFilename": "logos/tip-ogrencileri-platformu-icon-only-original.png",
      "status": "PASS",
      "validation": {
        "sha256": "ad60e3693cf6f6f163e4a413b9238320f12244bb367528f391ffadb3e3bf7a79",
        "width": 594,
        "height": 1636,
        "hasAlpha": true,
        "isOpaque": false,
        "embeddedCheckerboard": false,
        "artworkMatchesSlot": true,
        "result": "PASS",
        "reason": "Programmatically re-extracted: flat near-white background removed via brightness/saturation threshold, true RGBA alpha applied, tightly cropped to content."
      }
    },
    {
      "slot": 8,
      "form": "ICON_ONLY",
      "treatment": "WHITE",
      "expectedFilename": "tip-ogrencileri-platformu-icon-only-white.png",
      "receivedFilename": "logos/tip-ogrencileri-platformu-icon-only-white.png",
      "status": "PASS",
      "validation": {
        "sha256": "9a051353081d2c0ef0f426455e8b25435d65ecc670f1329debeea78dc60d0239",
        "width": 434,
        "height": 1199,
        "hasAlpha": true,
        "isOpaque": false,
        "embeddedCheckerboard": false,
        "artworkMatchesSlot": true,
        "result": "PASS",
        "reason": "Already had real RGBA transparency; re-cropped to its own tight content bounds and centered on a canvas matching the aspect ratio of slots 7 and 9, resolving the previous crop-inconsistency finding."
      }
    },
    {
      "slot": 9,
      "form": "ICON_ONLY",
      "treatment": "BLACK",
      "expectedFilename": "tip-ogrencileri-platformu-icon-only-black.png",
      "receivedFilename": "logos/tip-ogrencileri-platformu-icon-only-black.png",
      "status": "PASS",
      "validation": {
        "sha256": "685ef1429272a49e2ec2e09d715c6d3079710a8c43eb692ad9a61fd22fccb546",
        "width": 589,
        "height": 1627,
        "hasAlpha": true,
        "isOpaque": false,
        "embeddedCheckerboard": false,
        "artworkMatchesSlot": true,
        "result": "PASS",
        "reason": "Programmatically re-extracted: flat near-white background removed via brightness/saturation threshold, true RGBA alpha applied, tightly cropped to content."
      }
    },
    {
      "slot": 10,
      "form": "VERTICAL",
      "treatment": "ORIGINAL",
      "expectedFilename": "tip-ogrencileri-platformu-vertical-original.png",
      "receivedFilename": "logos/tip-ogrencileri-platformu-vertical-original.png",
      "status": "PASS",
      "validation": {
        "sha256": "7c813d89ba7dd40bcf98b77de59695b2c38235b40ef737bc99cc10ade511b8eb",
        "width": 816,
        "height": 1661,
        "hasAlpha": true,
        "isOpaque": false,
        "embeddedCheckerboard": false,
        "artworkMatchesSlot": true,
        "result": "PASS",
        "reason": "Programmatically re-extracted: flat near-white background removed via brightness/saturation threshold, true RGBA alpha applied, tightly cropped to content."
      }
    },
    {
      "slot": 11,
      "form": "VERTICAL",
      "treatment": "WHITE",
      "expectedFilename": "tip-ogrencileri-platformu-vertical-white.png",
      "receivedFilename": "logos/tip-ogrencileri-platformu-vertical-white.png",
      "status": "PASS",
      "validation": {
        "sha256": "b33d1525e3246436731b9659e1334930b37ba138969574425764ec135e992433",
        "width": 805,
        "height": 1690,
        "hasAlpha": true,
        "isOpaque": false,
        "embeddedCheckerboard": false,
        "artworkMatchesSlot": true,
        "result": "PASS",
        "reason": "Silhouette mask derived from the geometrically-aligned slot 12 (vertical black) source, since slot 11's own white-on-near-white source had no reliable direct brightness separation. Rendered solid white on true alpha transparency, tightly cropped to content."
      }
    },
    {
      "slot": 12,
      "form": "VERTICAL",
      "treatment": "BLACK",
      "expectedFilename": "tip-ogrencileri-platformu-vertical-black.png",
      "receivedFilename": "logos/tip-ogrencileri-platformu-vertical-black.png",
      "status": "PASS",
      "validation": {
        "sha256": "b2e16c4b9ef07059bccc6efcee85f5a18e023bce12c6d672b3f74ce11b169f53",
        "width": 805,
        "height": 1690,
        "hasAlpha": true,
        "isOpaque": false,
        "embeddedCheckerboard": false,
        "artworkMatchesSlot": true,
        "result": "PASS",
        "reason": "Programmatically re-extracted: flat near-white background removed via brightness/saturation threshold, true RGBA alpha applied, tightly cropped to content."
      }
    }
  ]
}
