{
  "schemaVersion": "1.0.0",
  "channelId": "dua-mecmuasi",
  "version": "0.1.0",
  "status": "COLLECTING",
  "assetPrefix": "dua-mecmuasi",
  "expectedCount": 12,
  "assets": [
    {
      "slot": 1, "form": "CIRCULAR", "treatment": "ORIGINAL",
      "expectedFilename": "dua-mecmuasi-circular-original.png",
      "receivedFilename": "logos/dua-mecmuasi-circular-original.png",
      "status": "PASS",
      "validation": {
        "sha256": "3e1e8664bbc9bb2437b8f8f7d6e5437eea95cc4f2b7a09985da43184dad4d119",
        "width": 1268, "height": 1241, "hasAlpha": true, "isOpaque": false,
        "embeddedCheckerboard": false, "artworkMatchesSlot": true, "result": "PASS",
        "reason": "Selected from the pack's 'badge' set (mosque-arch silhouette, crescent-star, praying hands, full wordmark + tagline, cream disc fill within an olive ring). Already had real RGBA transparency; re-cropped to its own tight content bounds."
      }
    },
    {
      "slot": 2, "form": "CIRCULAR", "treatment": "WHITE",
      "expectedFilename": "dua-mecmuasi-circular-white.png",
      "receivedFilename": "logos/dua-mecmuasi-circular-white.png",
      "status": "PASS",
      "validation": {
        "sha256": "fe1d6e6e54cbfbed0b8f3c2707e8fd2b8a9b1eabe9769796d84f0f91046adf4f",
        "width": 1268, "height": 1241, "hasAlpha": true, "isOpaque": false,
        "embeddedCheckerboard": false, "artworkMatchesSlot": true, "result": "PASS",
        "reason": "Already had real RGBA transparency; re-cropped to its own tight content bounds."
      }
    },
    {
      "slot": 3, "form": "CIRCULAR", "treatment": "BLACK",
      "expectedFilename": "dua-mecmuasi-circular-black.png",
      "receivedFilename": "logos/dua-mecmuasi-circular-black.png",
      "status": "PASS",
      "validation": {
        "sha256": "361b12af535e2d4ec4df02973e6f47095b90d0c7ba5794faf90f26a809302d05",
        "width": 1268, "height": 1241, "hasAlpha": true, "isOpaque": false,
        "embeddedCheckerboard": false, "artworkMatchesSlot": true, "result": "PASS",
        "reason": "Already had real RGBA transparency; re-cropped to its own tight content bounds."
      }
    },
    {
      "slot": 4, "form": "HORIZONTAL", "treatment": "ORIGINAL",
      "expectedFilename": "dua-mecmuasi-horizontal-original.png",
      "receivedFilename": "logos/dua-mecmuasi-horizontal-original.png",
      "status": "PASS",
      "validation": {
        "sha256": "367464412b7af390058e077766e2dd329ce51d85f46a7ca525ffdc535e361115",
        "width": 1681, "height": 329, "hasAlpha": true, "isOpaque": false,
        "embeddedCheckerboard": false, "artworkMatchesSlot": true, "result": "PASS",
        "reason": "Wordmark-only lockup ('dua' large + 'mecmuasi' smaller, single line). Already had real RGBA transparency; re-cropped to its own tight content bounds."
      }
    },
    {
      "slot": 5, "form": "HORIZONTAL", "treatment": "WHITE",
      "expectedFilename": "dua-mecmuasi-horizontal-white.png",
      "receivedFilename": "logos/dua-mecmuasi-horizontal-white.png",
      "status": "PASS",
      "validation": {
        "sha256": "0b8f1ae9734eaa5deb6148e37020409ffc4edbd65560cd05ed1961a0311bc4ef",
        "width": 1681, "height": 329, "hasAlpha": true, "isOpaque": false,
        "embeddedCheckerboard": false, "artworkMatchesSlot": true, "result": "PASS",
        "reason": "Already had real RGBA transparency; re-cropped to its own tight content bounds."
      }
    },
    {
      "slot": 6, "form": "HORIZONTAL", "treatment": "BLACK",
      "expectedFilename": "dua-mecmuasi-horizontal-black.png",
      "receivedFilename": "logos/dua-mecmuasi-horizontal-black.png",
      "status": "PASS",
      "validation": {
        "sha256": "0c70d5418b0eeb3befae6e6d8cbb1b1a3d80a9f7dca0f0f40be94ab10ff0bcdb",
        "width": 1681, "height": 329, "hasAlpha": true, "isOpaque": false,
        "embeddedCheckerboard": false, "artworkMatchesSlot": true, "result": "PASS",
        "reason": "Already had real RGBA transparency; re-cropped to its own tight content bounds."
      }
    },
    {
      "slot": 7, "form": "ICON_ONLY", "treatment": "ORIGINAL",
      "expectedFilename": "dua-mecmuasi-icon-only-original.png",
      "status": "PENDING"
    },
    {
      "slot": 8, "form": "ICON_ONLY", "treatment": "WHITE",
      "expectedFilename": "dua-mecmuasi-icon-only-white.png",
      "status": "PENDING"
    },
    {
      "slot": 9, "form": "ICON_ONLY", "treatment": "BLACK",
      "expectedFilename": "dua-mecmuasi-icon-only-black.png",
      "status": "PENDING"
    },
    {
      "slot": 10, "form": "VERTICAL", "treatment": "ORIGINAL",
      "expectedFilename": "dua-mecmuasi-vertical-original.png",
      "receivedFilename": "logos/dua-mecmuasi-vertical-original.png",
      "status": "PASS",
      "validation": {
        "sha256": "e66bc9c279e0cfa2caf083c5f8e1c235d44ba7bfa4e5516754ec938c07e87c8e",
        "width": 981, "height": 533, "hasAlpha": true, "isOpaque": false,
        "embeddedCheckerboard": false, "artworkMatchesSlot": true, "result": "PASS",
        "reason": "Selected from the pack's 'stacked' set (mosque-arch icon above the two-line wordmark). Already had real RGBA transparency; re-cropped to its own tight content bounds."
      }
    },
    {
      "slot": 11, "form": "VERTICAL", "treatment": "WHITE",
      "expectedFilename": "dua-mecmuasi-vertical-white.png",
      "receivedFilename": "logos/dua-mecmuasi-vertical-white.png",
      "status": "PASS",
      "validation": {
        "sha256": "bb1c834c7abdd100910cd1e0b00bb7277702f342ce3ea8e53ea81afe3167aad9",
        "width": 981, "height": 533, "hasAlpha": true, "isOpaque": false,
        "embeddedCheckerboard": false, "artworkMatchesSlot": true, "result": "PASS",
        "reason": "Already had real RGBA transparency; re-cropped to its own tight content bounds."
      }
    },
    {
      "slot": 12, "form": "VERTICAL", "treatment": "BLACK",
      "expectedFilename": "dua-mecmuasi-vertical-black.png",
      "receivedFilename": "logos/dua-mecmuasi-vertical-black.png",
      "status": "PASS",
      "validation": {
        "sha256": "4181738f8a6c3d4b80e8465050ce9c41127f65e403e3251930e0eb0ca6316241",
        "width": 981, "height": 533, "hasAlpha": true, "isOpaque": false,
        "embeddedCheckerboard": false, "artworkMatchesSlot": true, "result": "PASS",
        "reason": "Already had real RGBA transparency; re-cropped to its own tight content bounds."
      }
    }
  ]
}
