{
  "schemaVersion": "1.0.0",
  "channelId": "scope-turkiye",
  "version": "0.1.0",
  "status": "PASS",
  "assetPrefix": "scope-turkiye",
  "expectedCount": 12,
  "assets": [
    {
      "slot": 1, "form": "CIRCULAR", "treatment": "ORIGINAL",
      "expectedFilename": "scope-turkiye-circular-original.png",
      "receivedFilename": "logos/scope-turkiye-circular-original.png",
      "status": "PASS",
      "validation": {
        "sha256": "24e56b25e260c9a1540b2bb3291aae6ce895f3637db7516dfc8cebe9706ac4b6",
        "width": 1254, "height": 1254, "hasAlpha": true, "isOpaque": false,
        "embeddedCheckerboard": false, "artworkMatchesSlot": true, "result": "PASS",
        "reason": "Badge: navy ring with 'YOUR TRUSTED GATEWAY' arc text, gold pinstripe rings, cream center with navy 'SCOPE' wordmark (compass/target as the O) and gold 'TURKIYE' subtext. Already had real RGBA transparency and a tight crop."
      }
    },
    {
      "slot": 2, "form": "CIRCULAR", "treatment": "WHITE",
      "expectedFilename": "scope-turkiye-circular-white.png",
      "receivedFilename": "logos/scope-turkiye-circular-white.png",
      "status": "PASS",
      "validation": {
        "sha256": "4929d15ef35c9ef0797bed1fb4611c93b808f235be5268b83c94ff2fc4a2ceb0",
        "width": 1254, "height": 1254, "hasAlpha": true, "isOpaque": false,
        "embeddedCheckerboard": false, "artworkMatchesSlot": true, "result": "PASS",
        "reason": "Already had real RGBA transparency and a tight crop."
      }
    },
    {
      "slot": 3, "form": "CIRCULAR", "treatment": "BLACK",
      "expectedFilename": "scope-turkiye-circular-black.png",
      "receivedFilename": "logos/scope-turkiye-circular-black.png",
      "status": "PASS",
      "validation": {
        "sha256": "870950da40b3215dec3176f0ff3118a788132d38883c1cf68c0b04614dcb6c26",
        "width": 1254, "height": 1254, "hasAlpha": true, "isOpaque": false,
        "embeddedCheckerboard": false, "artworkMatchesSlot": true, "result": "PASS",
        "reason": "Already had real RGBA transparency and a tight crop."
      }
    },
    { "slot": 4, "form": "HORIZONTAL", "treatment": "ORIGINAL", "expectedFilename": "scope-turkiye-horizontal-original.png", "status": "PENDING" },
    { "slot": 5, "form": "HORIZONTAL", "treatment": "WHITE", "expectedFilename": "scope-turkiye-horizontal-white.png", "status": "PENDING" },
    { "slot": 6, "form": "HORIZONTAL", "treatment": "BLACK", "expectedFilename": "scope-turkiye-horizontal-black.png", "status": "PENDING" },
    { "slot": 7, "form": "ICON_ONLY", "treatment": "ORIGINAL", "expectedFilename": "scope-turkiye-icon-only-original.png", "status": "PENDING" },
    { "slot": 8, "form": "ICON_ONLY", "treatment": "WHITE", "expectedFilename": "scope-turkiye-icon-only-white.png", "status": "PENDING" },
    { "slot": 9, "form": "ICON_ONLY", "treatment": "BLACK", "expectedFilename": "scope-turkiye-icon-only-black.png", "status": "PENDING" },
    { "slot": 10, "form": "VERTICAL", "treatment": "ORIGINAL", "expectedFilename": "scope-turkiye-vertical-original.png", "status": "PENDING" },
    { "slot": 11, "form": "VERTICAL", "treatment": "WHITE", "expectedFilename": "scope-turkiye-vertical-white.png", "status": "PENDING" },
    { "slot": 12, "form": "VERTICAL", "treatment": "BLACK", "expectedFilename": "scope-turkiye-vertical-black.png", "status": "PENDING" }
  ]
}
