{
  "schemaVersion": "1.0.0",
  "channelId": "tip-ogrencileri-platformu",
  "version": "0.1.0",
  "status": "COLLECTING",
  "assetPrefix": "tob",
  "expectedCount": 12,
  "assets": [
    {
      "slot": 1,
      "form": "CIRCULAR",
      "treatment": "ORIGINAL",
      "expectedFilename": "tob_circular_original.png",
      "status": "NEEDS_CORRECTION",
      "validation": {
        "sha256": "e4334dba62b142b8dc2bcec779530ea0020d098ac0f09376dd03f93aa8fbd09e",
        "width": 1254,
        "height": 1254,
        "hasAlpha": false,
        "isOpaque": true,
        "embeddedCheckerboard": true,
        "result": "NEEDS_CORRECTION",
        "reason": "The checkerboard is embedded in an opaque RGB image; a real transparent background is required."
      }
    },
    {
      "slot": 2,
      "form": "CIRCULAR",
      "treatment": "WHITE",
      "expectedFilename": "tob_circular_white.png",
      "receivedFilename": "codex-clipboard-eb514e59-1e23-4899-9652-af8fdbef6ca8.png",
      "status": "NEEDS_CORRECTION",
      "validation": {
        "sha256": "ac872affe8d7f00babd119072d43c8f871d320b1d6ddbe14e7126511a3e492a9",
        "width": 1254,
        "height": 1254,
        "hasAlpha": false,
        "isOpaque": true,
        "embeddedCheckerboard": true,
        "result": "NEEDS_CORRECTION",
        "reason": "The artwork matches the circular white slot, but the filename is incorrect and the checkerboard is embedded in an opaque RGB image."
      }
    },
    {
      "slot": 3,
      "form": "CIRCULAR",
      "treatment": "BLACK",
      "expectedFilename": "tob_circular_black.png",
      "receivedFilename": "codex-clipboard-41c6ebaa-2d12-46f0-80b7-d9b3c1bcdc75.png",
      "status": "NEEDS_CORRECTION",
      "validation": {
        "sha256": "78ec229ca63611bb6c2d60f59b366f830408ae8b49f55682d76ceeb284df5956",
        "width": 1254,
        "height": 1254,
        "hasAlpha": false,
        "isOpaque": true,
        "embeddedCheckerboard": true,
        "result": "NEEDS_CORRECTION",
        "reason": "The artwork matches the circular black slot, but the filename is incorrect and the checkerboard is embedded in an opaque RGB image."
      }
    },
    {
      "slot": 4,
      "form": "HORIZONTAL",
      "treatment": "ORIGINAL",
      "expectedFilename": "tob_horizontal_original.png",
      "receivedFilename": "codex-clipboard-5a4c2fb7-63d4-4f5e-a1d1-a00cd9737048.png",
      "status": "NEEDS_CORRECTION",
      "validation": {
        "sha256": "80a6ff28863fd4fe6bfa28ee2b8e7b35ae4ff35d1903c518c7fb1a54d47d76fa",
        "width": 1774,
        "height": 887,
        "hasAlpha": false,
        "isOpaque": true,
        "embeddedCheckerboard": true,
        "result": "NEEDS_CORRECTION",
        "reason": "The artwork and 2:1 canvas match the horizontal original slot, but the filename is incorrect and the checkerboard is embedded in an opaque RGB image."
      }
    },
    {
      "slot": 5,
      "form": "HORIZONTAL",
      "treatment": "WHITE",
      "expectedFilename": "tob_horizontal_white.png",
      "receivedFilename": "exec-3dcaeca2-b6bf-4bc8-a8fa-d58153595663.png",
      "status": "NEEDS_CORRECTION",
      "validation": {
        "sha256": "ef07dd960ed060495dbfe4161e07f54342927204df56d003324337bfcb3699a4",
        "width": 1774,
        "height": 887,
        "hasAlpha": false,
        "isOpaque": true,
        "embeddedCheckerboard": true,
        "result": "NEEDS_CORRECTION",
        "reason": "The artwork and 2:1 canvas match the horizontal white slot, but the filename is incorrect and the checkerboard is embedded in an opaque RGB image."
      }
    },
    {
      "slot": 6,
      "form": "HORIZONTAL",
      "treatment": "BLACK",
      "expectedFilename": "tob_horizontal_black.png",
      "receivedFilename": "exec-f555c9c2-fe27-43fb-b6f6-7d7693aac679.png",
      "status": "NEEDS_CORRECTION",
      "validation": {
        "sha256": "130196e5214292d21add539e798d37d24640f828b84684231007ed0a67444d51",
        "width": 1774,
        "height": 887,
        "hasAlpha": false,
        "isOpaque": true,
        "embeddedCheckerboard": true,
        "result": "NEEDS_CORRECTION",
        "reason": "The artwork and 2:1 canvas match the horizontal black slot, but the filename is incorrect and the checkerboard is embedded in an opaque RGB image."
      }
    },
    { "slot": 7, "form": "ICON_ONLY", "treatment": "ORIGINAL", "expectedFilename": "tob_icon-only_original.png", "status": "PENDING" },
    { "slot": 8, "form": "ICON_ONLY", "treatment": "WHITE", "expectedFilename": "tob_icon-only_white.png", "status": "PENDING" },
    { "slot": 9, "form": "ICON_ONLY", "treatment": "BLACK", "expectedFilename": "tob_icon-only_black.png", "status": "PENDING" },
    { "slot": 10, "form": "VERTICAL", "treatment": "ORIGINAL", "expectedFilename": "tob_vertical_original.png", "status": "PENDING" },
    { "slot": 11, "form": "VERTICAL", "treatment": "WHITE", "expectedFilename": "tob_vertical_white.png", "status": "PENDING" },
    { "slot": 12, "form": "VERTICAL", "treatment": "BLACK", "expectedFilename": "tob_vertical_black.png", "status": "PENDING" }
  ]
}
